{
  "schema_version": "agent-stack-train.stack-releases.v1",
  "release_train": "current",
  "published_by": "https://github.com/Pukujan/agent-stack-train",
  "recorded_at": "2026-10-30T23:44:10Z",
  "status": "certified",
  "certified": {
    "project-continuity-modules": {
      "version": "0.7.0",
      "commit": "418f5591ebd9e548eb87d7e689654d0d6b3146e2",
      "cli": "0.7.0",
      "protocol_version": "0.1.0-draft",
      "role": "Execution continuity: tasks, checkpoints, immutable push receipts, required PR gates."
    },
    "content-generation-modules": {
      "version": "0.5.13",
      "commit": "c47740d71ca68be6a782b24dd8f28b905c620506",
      "modules": 8,
      "role": "Narrative and styling authority: writing routing, human-sounding writing, output naming, visual direction, image generation."
    },
    "agent-custom-setup": {
      "version": "0.2.0",
      "commit": "470013ed3380262cc85568bff83e563ecdbab491",
      "module": "multi-agent-hotload",
      "role": "Install surface: hot-load FULL PCM + FULL CGM + OIO plus the coordination runtime."
    },
    "observational-issue-ops": {
      "version": "0.3.0",
      "commit": "6a9a7cd67810debe0da76e847ac9897ebc281248",
      "role": "Issue-log ticketing system: the canonical issue form, the filer stamp, and its triage."
    }
  },
  "adoption_rule": "This file records the certified versions of project-continuity-modules, content-generation-modules, agent-custom-setup, and observational-issue-ops. The four live in this one repository and move together at one commit, so none of them pins another. An adopter follows this file through its stack-manifest.json: a pin that copies an older version or commit than the one recorded here fails scripts/check_manifest.py.",
  "note": "Nothing rewrites this file automatically; change it in a pull request. recorded_at changes only when a certified entry or this rule changes."
}
